{
  "schema_version": 1,
  "interpretation_version": "0.1.0-pilot",
  "comparison_policy": "same-language-and-config-only",
  "minimum_provisional_cohort": 3,
  "minimum_classified_cohort": 10,
  "profiles": [
    {
      "package_id": "cutadapt__5.2__py313hd978853_2__linux-64",
      "languages": [
        {
          "language": "cython",
          "metrics": [],
          "measured_count": 0
        },
        {
          "language": "python",
          "metrics": [
            {
              "check_id": "PY-BANDIT-001",
              "label": "Security indicators",
              "value": 5.798394290811776,
              "unit": "per 1k lines",
              "higher_is_better": false,
              "cohort_size": 3,
              "percentile": 83.33333333333333,
              "interpretation": "provisional"
            },
            {
              "check_id": "PY-INTERROGATE-001",
              "label": "Docstring coverage",
              "value": 36.3,
              "unit": "percent",
              "higher_is_better": true,
              "cohort_size": 3,
              "percentile": 16.666666666666668,
              "interpretation": "provisional"
            },
            {
              "check_id": "PY-PYLINT-001",
              "label": "Pylint messages",
              "value": 66.90454950936663,
              "unit": "per 1k lines",
              "higher_is_better": false,
              "cohort_size": 3,
              "percentile": 16.666666666666668,
              "interpretation": "provisional"
            },
            {
              "check_id": "PY-RADON-001",
              "label": "Mean cyclomatic complexity",
              "value": 2.909090909090909,
              "unit": "raw",
              "higher_is_better": false,
              "cohort_size": 3,
              "percentile": 16.666666666666668,
              "interpretation": "provisional"
            },
            {
              "check_id": "PY-RUFF-001",
              "label": "Ruff findings",
              "value": 59.76806422836753,
              "unit": "per 1k lines",
              "higher_is_better": false,
              "cohort_size": 3,
              "percentile": 83.33333333333333,
              "interpretation": "provisional"
            },
            {
              "check_id": "PY-VULTURE-001",
              "label": "Dead-code candidates",
              "value": 2.6761819803746656,
              "unit": "per 1k lines",
              "higher_is_better": false,
              "cohort_size": 3,
              "percentile": 16.666666666666668,
              "interpretation": "provisional"
            }
          ],
          "measured_count": 6
        }
      ]
    },
    {
      "package_id": "nanoplot__1.47.1__pyhdfd78af_0__noarch",
      "languages": [
        {
          "language": "python",
          "metrics": [
            {
              "check_id": "PY-BANDIT-001",
              "label": "Security indicators",
              "value": 1.6835016835016836,
              "unit": "per 1k lines",
              "higher_is_better": false,
              "cohort_size": 3,
              "percentile": 16.666666666666668,
              "interpretation": "provisional"
            },
            {
              "check_id": "PY-INTERROGATE-001",
              "label": "Docstring coverage",
              "value": 39.4,
              "unit": "percent",
              "higher_is_better": true,
              "cohort_size": 3,
              "percentile": 50.0,
              "interpretation": "provisional"
            },
            {
              "check_id": "PY-PYLINT-001",
              "label": "Pylint messages",
              "value": 125.84175084175084,
              "unit": "per 1k lines",
              "higher_is_better": false,
              "cohort_size": 3,
              "percentile": 83.33333333333333,
              "interpretation": "provisional"
            },
            {
              "check_id": "PY-RADON-001",
              "label": "Mean cyclomatic complexity",
              "value": 4.079545454545454,
              "unit": "raw",
              "higher_is_better": false,
              "cohort_size": 3,
              "percentile": 83.33333333333333,
              "interpretation": "provisional"
            },
            {
              "check_id": "PY-RUFF-001",
              "label": "Ruff findings",
              "value": 39.14141414141414,
              "unit": "per 1k lines",
              "higher_is_better": false,
              "cohort_size": 3,
              "percentile": 50.0,
              "interpretation": "provisional"
            },
            {
              "check_id": "PY-VULTURE-001",
              "label": "Dead-code candidates",
              "value": 8.417508417508417,
              "unit": "per 1k lines",
              "higher_is_better": false,
              "cohort_size": 3,
              "percentile": 83.33333333333333,
              "interpretation": "provisional"
            }
          ],
          "measured_count": 6
        }
      ]
    },
    {
      "package_id": "rasusa__4.1.0__hfa8f182_0__linux-64",
      "languages": [
        {
          "language": "rust",
          "metrics": [],
          "measured_count": 0
        }
      ]
    },
    {
      "package_id": "sourmash__4.9.4__hdfd78af_0__noarch",
      "languages": [
        {
          "language": "python",
          "metrics": [
            {
              "check_id": "PY-BANDIT-001",
              "label": "Security indicators",
              "value": 5.489478499542543,
              "unit": "per 1k lines",
              "higher_is_better": false,
              "cohort_size": 3,
              "percentile": 50.0,
              "interpretation": "provisional"
            },
            {
              "check_id": "PY-INTERROGATE-001",
              "label": "Docstring coverage",
              "value": 48.9,
              "unit": "percent",
              "higher_is_better": true,
              "cohort_size": 3,
              "percentile": 83.33333333333333,
              "interpretation": "provisional"
            },
            {
              "check_id": "PY-PYLINT-001",
              "label": "Pylint messages",
              "value": 94.3732845379689,
              "unit": "per 1k lines",
              "higher_is_better": false,
              "cohort_size": 3,
              "percentile": 50.0,
              "interpretation": "provisional"
            },
            {
              "check_id": "PY-RADON-001",
              "label": "Mean cyclomatic complexity",
              "value": 3.470987189148455,
              "unit": "raw",
              "higher_is_better": false,
              "cohort_size": 3,
              "percentile": 50.0,
              "interpretation": "provisional"
            },
            {
              "check_id": "PY-RUFF-001",
              "label": "Ruff findings",
              "value": 35.49862763037511,
              "unit": "per 1k lines",
              "higher_is_better": false,
              "cohort_size": 3,
              "percentile": 16.666666666666668,
              "interpretation": "provisional"
            },
            {
              "check_id": "PY-VULTURE-001",
              "label": "Dead-code candidates",
              "value": 4.803293687099726,
              "unit": "per 1k lines",
              "higher_is_better": false,
              "cohort_size": 3,
              "percentile": 50.0,
              "interpretation": "provisional"
            }
          ],
          "measured_count": 6
        },
        {
          "language": "rust",
          "metrics": [],
          "measured_count": 0
        }
      ]
    }
  ]
}
